name,organization_name,membership_label,description,timespan
ЩОТКІН Віталій Іванович,Генеральна прокуратура України,перший заступник начальника управління організаційного та правового забезпечення  Генеральної прокуратури України,Наказ Генеральної прокуратури України від 23 жовтня 2014 року № 2510-ц,10 років
БІЛЕЦЬКИЙ Ігор Альфредович,Генеральна прокуратура України,заступник начальника Головного управління кадрів та забезпечення діяльності органів прокуратури-начальник управління внутрішньої безпеки та захисту працівників прокуратури Генеральної прокуратури України,Наказ Генеральної прокуратури України від 23 жовтня 2014 року № 2493-ц,10 років
СКРИПНИК Руслан Вячеславович,Управління МВС України в Сумській області,перший заступник начальника Управління МВС України в Сумській області – начальник слідчого управління,наказ Міністерства внутрішніх справ України від 27.10.2014 2239о/с,10 років
ПАРУБЕЦЬ Олександр Іванович,управління Пенсійного фонду України в Самарському районі м. Дніпропетровська,Начальник управління Пенсійного фонду України в Самарському районі м. Дніпропетровська,Наказ Головного управління Пенсійного фонду України в Дніпропетровській області від 21.10.2014 № 566-ОС,10 років
БАЛАН Андрій Петрович,Головне управління Міндоходів у Чернівецькій області,перший заступник начальника слідчого управління фінансових розслідувань Головного управління Міндоходів у Чернівецькій області,Наказ Міністерства доходів і зборів України від 29.10.2014 № 2176-о,10 років
МАЖАН Олексій Григорович,Секретаріат Кабінету Міністрів України,перший заступник директора Департаменту з питань діяльності правоохоронних  органів та органів юстиції  Секретаріату Кабінету Міністрів України,Витяг з наказу Кабінету Міністрів України від 20 листопада 2014 року № 854-к,10 років
ЛЯЦЕВИЧ Вадим Васильович,Генеральна прокуратура України,старший прокурор відділу процесуального керівництва та підтримання державного обвинувачення у кримінальних провадженнях про корупційні злочини управління нагляду за додержанням законів спецпідрозділами та іншими органами які ведуть боротьбу з організованою злочинністю і корупцією Головного управління захисту прав і свобод громадян інтересів держави нагляду за додержанням законів спецпідрозділами та іншими органами які ведуть боротьбу з організованою злочинністю і корупцією Генеральної прокуратури України,Наказ Генеральної прокуратури України від 01 грудня 2014 року № 2723у,10 років
РУДЕНКО Михайло Михайлович,Управління МВС України в Житомирській області,перший заступник начальника Управління МВС України в Житомирській області – начальник слідчого управління,наказ Міністерства внутрішніх справ України від 27.10.2014 2239о/с,10 років
ТАКТАШОВ Яков Октябрійович,Генеральна прокуратура України,заступник начальника відділу участі прокурорів у перегляді судових рішень Верховним Судом України управління організації участі прокурорів у кримінальному провадженні в суді  Головного управління предствавництва та організації участі у кримінальному провадженні Генеральної прокуратури України,Наказ Генеральної прокуратури України від 23 жовтня 2014 року № 2527-ц,10 років
ЛАЗАРЄВ Дмитро Володимирович,Управління МВС України в Рівненській області,Начальник Управління МВС України в Рівненській області,наказ Міністерства внутрішніх справ України від 24.10.2014 № 2218 о/с,10 років
ГАВРІН Роман Іванович,Мар'їнська районна державна адміністрація Донецької області,Голова Мар'їнської районної державної адміністрації в Донецькій області,Розпорядження Президента України від 30.10.2014 № 1208/2014-рп,10 років
ВУЧКАН Сергій Феодосійович,ГУ МВС України у Львівській області,перший заступник начальника ГУ МВС України у Львівській області - начальник слідчого управління,наказ Міністерства внутрішніх справ України від 27.10.2014 № 2239о/с,10 років
ПОТІМКОВ Олександр Юрійович,Державна служба України з питань регуляторної політики та розвитку підприємництва,Перший заступник Голови Державної служби України з питань регуляторної політики та розвитку підприємництва,Розпорядження Кабінету Міністрів України від 16 жовтня 2014 року № 980-р,10 років
КУЩЕНКО Юрій Віталійович,Служба безпеки України,заступник начальника  управління,Наказ Служби безпеки України від   жовтня 2014 року  №,10 років
КУЗЬМЕНКО Сергій Анатолійович,прокуратура Дніпропетровської області,заступник прокурора Дніпропетровської області,Наказ Генеральної прокуратури України від 23 жовтня 2014 року № 1438к,10 років
ЛАХТЮК Леонід Васильович,прокуратура Харківської області,заступник прокурора Харківської області,Наказ Генеральної прокуратури України від 23 жовтня 2014 року № 1476к,10 років
МИХАЛЬЧУК Юрій Володимирович,Управління МВС України в Рівненській області,начальник управління матеріального забезпечення Управління МВС України в Рівненській області,Наказ  Міністерства внутрішніх справ України від 28.10.2014 № 2253 о/с,10 років
ШАГАНЕНКО Петро Іванович,Генеральна прокуратура України,перший заступник начальника управління справами Головного управління кадрів та забезпечення діяльності органів прокуратури  Генеральної прокуратури України,Наказ Генеральної прокуратури України від 23 жовтня 2014 року № 2505-ц,10 років
ЯКУНІН Вячеслав Юрійович,Генеральна прокуратура України,перший заступник начальника управління з розслідування особливо важливих справ Головного слідчого управління Генеральної прокуратури України,Наказ Генеральної прокуратури України від 01 грудня 2014 року № 2717у,10 років
СИДОРЧУК Олег Олександрович,прокуратура Закарпатської області,прокурор Закарпатської області,Наказ Генеральної прокуратури України від 23 жовтня 2014 року № 1445к,10 років
КОШЕЛЄВ Ігор Ігорович,Державне агентство автомобільних доріг України,Заступник Голови Державного агентства автомобільних доріг України,Розпорядження Кабінету Міністрів України від 16 жовтня 2014 року № 988-р,10 років
ДИБЕЦЬ Юрій Юрійович,Генеральна прокуратура України,перший заступник начальника Головного управління нагляду за додержанням законів у воєній сфері Генеральної прокуратури України,Наказ Генеральної прокуратури України від 23 жовтня 2014 року № 2492-ц,10 років
ТЕРНО Андрій Михайлович,прокуратура Херсонської області,заступник прокурора Херсонської області,Наказ Генеральної прокуратури України від 23 жовтня 2014 року № 1480к,10 років
ШЕПЕЛЬ Андрій Володимирович,Служба безпеки України,офіцер діючого резерву,Наказ Служби безпеки України від   жовтня 2014 року  №,10 років
ШАРАВАРА  Василь Васильович,прокуратура Тернопільської області,перший заступник прокурора Тернопільської області,Наказ Генеральної прокуратури України від 23 жовтня 2014 року № 1474к,10 років
СОЛОМАТІН Роман Ігорович,Міністерство внутрішніх справ України,старший інспектор дорожньо-патрульної служби спеціалізованого відділення дорожньо-патрульної служби із забезпечення супроводження   спеціального	загону	дорожньо-патрульної	.служби особливого призначення (підпорядкованого Департаменту Державної автомобільної інспекції) при МВС України,Наказ Міністерства внутрішніх справ України від 08 грудня 2014 року № 2535 о/с,10 років
ЧІГУР Степан Володимирович,Генеральна прокуратура України,старший прокурор відділу організаційно-методичної роботи та координації діяльності правоохоронних органів у сфері протидії злочинності Головного управління нагляду у кримінальному провадженні Генеральної прокуратури України,Наказ Генеральної прокуратури України від 01 грудня 2014 року № 2724у,10 років
ПОРТНОВ Михайло Володимирович,Головне управління МВС України в Дніпропетровській області,заступник начальника Головного управління МВС України в Дніпропетровській області – начальник кримінальної міліції,Наказ Міністерства внутрішніх справ України від 27.10.2014 № 2239 о/с,10 років
ПРИХОДЬКО Олексанндр Васильович,Генеральна прокуратура України,заступник начальника управління нагляду за додержанням законів органами внутрішніх справ Головного управління нагляду у кримінальному провадженні Генеральної прокуратури України,Наказ Генеральної прокуратури України від 23 жовтня 2014 року № 2514-ц,10 років
АМЕЛІН Анатолій Ігорович,Національна комісія з цінних паперів та фондового ринку,член Національної комісії з цінних паперів та фондового ринку,Указ Президента України від 30 січня 2015 року №48/2015,10 років
ЦИЦЮРСЬКИЙ Микола Миколайович,Генеральний штаб Збройних Сил України,Начальник Відділу аналізу Генерального штабу Збройних Сил України,Наказ начальника Генерального штабу- Головнокомандувача Збройних Сил України  від 23 жовтня 2014 року № 56,10 років
ДЕМЬОХІН Володимир Анатолійович,Державна служба експортного контролю України,Голова Державної служби експортного контролю України,Розпорядження КМ від 16.10.2014 № 971-р,10 років
КУЗНЕЦОВ Сергій Вадимович,Головне управління Міндоходів у Чернігівській област,заступник начальника оперативного управління Головного управління Міндоходів у Чернігівській області,Наказ Міністерства доходів і зборів України від 29.10.2014 № 2177-о,10 років
РОЗІЗНАНИЙ Олександр Григорович,Управління МВС України в Хмельницькій області,начальник Управління МВС України в Хмельницькій області,Наказ Міністерства внутрішніх справ України від 27.10.2014 № 2238 о/с,10 років
НАСТЕКА Владислав Володимирович,Служба безпеки України,перший заступник начальника управління,Наказ Служби безпеки України від   жовтня 2014 року  №,10 років
ГОРДІЙЧУК  Микола Іванович,Головне управління Міндоходів у Житомирській області,помічник начальника відділу організації діяльності та контролю виконання документів Головного управління Міндоходів у Житомирській області,Головного управління Міндоходів у Житомирській області від 21 жовтня 2014 року № 298-о,10 років
КІПЕР Олег Олександрович,Генеральна прокуратура України,"старший прокурор  відділу нагляду за додержанням законів про боротьбу з відмиванням доходів, одержаних злочинним шляхом  управління нагляду за додержанням законів органами податкової міліції Головного управління нагляду у кримінальному провадженні Генеральної прокуратури України",Наказ Генеральної прокуратури України від 23 жовтня 2014 року № 2530-ц,10 років
БРОДСЬКИЙ Михайло Юрійович,Державна служба України з питань регуляторної політики та розвитку підприємництва,Голова Державної служби України з питань регуляторної політики та розвитку підприємництва,Розпорядження Кабінету Міністрів України від 16 жовтня 2014 року № 982-р,10 років
КУЗЬМЕНКО Андрій Дмитрович,прокуратура Херсонської області,заступник прокурора Херсонської області,Наказ Генеральної прокуратури України від 23 жовтня 2014 року № 1479к,10 років
СЕМЧЕНКО Олександр Анатолійович,Головне управління Міндоходів у Сумській області,начальник Головного управління Міндоходів у Сумській області,Наказ Міністерства освіти і науки від 01 грудня 2014 року № 416-а,10 років
ХОЛОША Володимир Іванович,Державне агентство України з управління зоною відчуження,Голова Державного агентства України з управління зоною відчуження,Розпорядження КМ від 16.10.2014 № 969-р,10 років
СТАСІВ Андрій Петрович,Генеральна прокуратура України,"начальник  управління захисту прав і свобод громадян та інтересів держави Головного управління захисту прав і свобод громадян, інтересів держави, нагляду за додержанням законів спецпідрозділами та іншими органами, які ведуть боротьбу з організованою злочинністю і корупцією Генеральної прокуратури України",Наказ Генеральної прокуратури України від 23 жовтня 2014 року № 2501-ц,10 років
ДУДНИК Юрій Павлович,Державна інспекції навчальних закладів України,Голова Державної інспекції навчальних закладів України,Розпорядження Кабінету Міністрів України від 16 жовтня 2014 року  № 986-р,10 років
ТРЕТЬЯКОВ Сергій Сергійович,Головне управління МВС України в Дніпропетровській області,заступник начальника Головного управління МВС України в Дніпропетровській області – начальник міліції громадської безпеки,Наказ Міністерства внутрішніх справ України від 27.10.2014 № 2239 о/с,10 років
ВИТРИКУШ Іван Ярославович,Прокуратура Івано-Франківської області,Коломийський міжрайонний прокурор Івано-Франківської області,Наказ Генеральної Прокуратури України від 23.10.2014 № 1452к,10 років
ЦИКРА Юрій Сергійович,Державна фіскальна служба України,заступник начальника Луганської митниці Міндоходів – начальник управління боротьби з контрабандою та митними правопорушеннями,Наказ Державної фіскальної служба України від 24.10.2014 № 1032-о,10 років
КРАВЦОВ Роман Олександрович,Управління МВС України на Придніпровській залізниці,начальник Управління МВС України на Придніпровській залізниці,Наказ Міністерства внутрішніх справ України від 27.10.2014 № 2238 о/с,10 років
НЕМЧИНОВ Павло Вікторович,Генеральна прокуратура України,заступник начальника управління з розслідування особливо важливих справ Головного слідчого  управління Генеральної прокуратури України,Наказ Генеральної прокуратури України від 23 жовтня 2014 року № 2513-ц,10 років
ШЕПЕЛЄВ Олександр Вікторович,"Управління МВС України в Кіровоградській області,",заступник начальника штабу Управління  МВС України в Кіровоградській області,Наказ  Міністерства внутрішніх справ України від 28.10.2014 № 2253 о/с,10 років
СУЧЕНКО Вячеслав Володимирович,Генеральна прокуратура України,перший заступник військового прокурора Центрального регіону України,Наказ Генеральної прокуратури України від 23 жовтня 2014 року № 1500-к,10 років
МАРЧЕНКО Юрій Миколайович,Генеральна прокуратура України,старший прокурор відділу нагляду за додержанням законів при провадженні оперативно-розшукової діяльності досудового розслідування та підтримання державного обвинувачення управління нагляду за додержанням законів органами податкової міліції Головного управління нагляду у кримінальному провадженні Генеральної прокуратури України,Наказ Генеральної прокуратури України від 01 грудня 2014 року № 2725у,10 років
ПЕТРЕНКО Віталій Петрович,Служба безпеки України,заступник начальника управління - начальник відділу,Наказ Служби безпеки України від   жовтня 2014 року  №,10 років
БАКАЙ Андрій Васильович,Генеральна прокуратура України,начальник третього відділу процесуарного керівництва досудовим розслідуванням і підтримання державного обвинувачення  управління нагляду за додержанням законів органами внутрішніх справ Головного управління нагляду у кримінальному провадженні Генеральної прокуратури України,Наказ Генеральної прокуратури України від 23 жовтня 2014 року № 2526-ц,10 років
